{"$schema":"https://schemas.cratis.io/factory/v2/artifact-receipt.schema.json","artifact":{"$schema":"https://schemas.cratis.io/factory/v2/artifact-descriptor.schema.json","classification":"internal","contentHash":"sha256:495f7f50dd08e5d1dbdf36693c2402014e9f621a98ba769ca7876ae5a7371dbf","documentKind":"artifact-descriptor","kind":"agent-context","mediaType":"application/json","protocolVersion":"2","reference":"artifact:sha256:495f7f50dd08e5d1dbdf36693c2402014e9f621a98ba769ca7876ae5a7371dbf","schema":{"contentHash":"sha256:a0834645aaa41f90f28da5dfdd8628984a56ff342e1fa6854c59a23aac20bb6a","id":"https://schemas.cratis.io/factory/v2/agent-context.schema.json"},"sizeBytes":1280},"authority":{"algorithm":"ed25519","issuer":"authority:sha256:2222222222222222222222222222222222222222222222222222222222222222","keyId":"key:sha256:3333333333333333333333333333333333333333333333333333333333333333","signature":"AAAAAAAAAAAAAAAAAAAAAAAAAAAAAAAAAAAAAAAAAAAAAAAAAAAAAAAAAAAAAAAAAAAAAAAAAAAAAAAAAAAAAA"},"contentHash":"sha256:d7194d2490e7703708cd8f9a82f431883e9d94872b0fc3366617ca5ff1228032","documentKind":"artifact-receipt","immutable":true,"issuedAt":"2026-08-15T12:00:00Z","protocolVersion":"2","retentionUntil":"2026-08-16T12:00:00Z","runId":"11111111-1111-4111-8111-111111111111","securityDomain":"security-domain:sha256:1111111111111111111111111111111111111111111111111111111111111111","store":{"generation":"33333333-3333-4333-8333-333333333333","id":"fixture-store"}}
